[
  { "id": "kubernetes-sunday-seven-is-an-error", "input": "0 9 * * 7", "options": { "dialect": "kubernetes" },
    "expectError": { "code": "out-of-range", "span": [8, 9] },
    "provenance": { "kind": "derived", "source": "corpus/DERIVATION.md K2" } },
  { "id": "kubernetes-reversed-range-is-an-error", "input": "0 10 * * SAT-SUN", "options": { "dialect": "kubernetes" },
    "expectError": { "code": "bad-range", "span": [9, 16] },
    "provenance": { "kind": "derived", "source": "corpus/DERIVATION.md K5" } },
  { "id": "kubernetes-single-value-with-step-runs-to-max", "input": "20/15 * * * *", "options": { "dialect": "kubernetes" },
    "expectSummary": { "dialect": "kubernetes", "values": { "minute": [20, 35, 50] } },
    "provenance": { "kind": "derived", "source": "corpus/DERIVATION.md K4" } },
  { "id": "kubernetes-oversized-step-keeps-the-minimum", "input": "*/90 * * * *", "options": { "dialect": "kubernetes" },
    "expectSummary": { "dialect": "kubernetes", "values": { "minute": [0] }, "star": { "minute": false } },
    "provenance": { "kind": "derived", "source": "corpus/DERIVATION.md K4" } },
  { "id": "kubernetes-question-mark-is-a-star-anywhere", "input": "? ? ? ? ?", "options": { "dialect": "kubernetes" },
    "expectSummary": { "dialect": "kubernetes", "values": { "hour": [0,1,2,3,4,5,6,7,8,9,10,11,12,13,14,15,16,17,18,19,20,21,22,23], "dayOfWeek": [0,1,2,3,4,5,6] }, "star": { "minute": true, "dayOfMonth": true, "dayOfWeek": true } },
    "provenance": { "kind": "derived", "source": "corpus/DERIVATION.md K3" } },
  { "id": "kubernetes-stepped-star-is-not-a-star", "input": "0 0 */2 * 1", "options": { "dialect": "kubernetes" },
    "expectSummary": { "dialect": "kubernetes", "star": { "dayOfMonth": false, "dayOfWeek": false } },
    "provenance": { "kind": "derived", "source": "corpus/DERIVATION.md K10" } },
  { "id": "kubernetes-star-inside-a-list-is-a-star", "input": "0 0 5,* * 1", "options": { "dialect": "kubernetes" },
    "expectSummary": { "dialect": "kubernetes", "star": { "dayOfMonth": true } },
    "provenance": { "kind": "derived", "source": "corpus/DERIVATION.md K10" } },
  { "id": "kubernetes-has-no-reboot", "input": "@reboot", "options": { "dialect": "kubernetes" },
    "expectError": { "code": "unknown-macro", "span": [0, 7] },
    "provenance": { "kind": "derived", "source": "corpus/DERIVATION.md K6" } },
  { "id": "kubernetes-takes-exactly-five-fields", "input": "0 0 12 * * 1", "options": { "dialect": "kubernetes" },
    "expectError": { "code": "field-count", "span": [0, 12] },
    "provenance": { "kind": "derived", "source": "corpus/DERIVATION.md K1" } },
  { "id": "kubernetes-names-in-ranges-any-case", "input": "0 0 * jan-mar mon-fri", "options": { "dialect": "kubernetes" },
    "expectSummary": { "dialect": "kubernetes", "values": { "month": [1, 2, 3], "dayOfWeek": [1, 2, 3, 4, 5] } },
    "provenance": { "kind": "derived", "source": "corpus/DERIVATION.md K2" } },
  { "id": "detect-question-mark-in-five-fields-is-kubernetes", "input": "0 0 ? * 1",
    "expectSummary": { "dialect": "kubernetes" },
    "provenance": { "kind": "assumed", "source": "corpus/DERIVATION.md K3, G10" } },
  { "id": "detect-reboot-is-vixie-only", "input": "@reboot",
    "expectSummary": { "dialect": "vixie" },
    "provenance": { "kind": "derived", "source": "corpus/DERIVATION.md K6" } }
]
