[
  { "id": "detect-weekend-range-is-vixie-only", "input": "0 10 * * SAT-SUN",
    "expectSummary": { "dialect": "vixie", "values": { "dayOfWeek": [0, 6] } },
    "provenance": { "kind": "derived", "source": "corpus/DERIVATION.md H3" } },
  { "id": "detect-quartz-by-question-mark-position", "input": "0 0 12 ? * MON",
    "expectSummary": { "dialect": "quartz", "values": { "hour": [12], "dayOfWeek": [1] }, "star": { "month": true, "dayOfMonth": false } },
    "provenance": { "kind": "spec" } },
  { "id": "detect-unsupported-token-is-reported", "input": "0 0 L * *",
    "expectSummary": { "dialect": "vixie", "unsupported": ["dayOfMonth"] },
    "provenance": { "kind": "spec" } },
  { "id": "detect-plain-five-fields-lists-all-three", "input": "0 9 * * 1",
    "expectSummary": { "dialect": "vixie", "candidates": ["vixie", "kubernetes", "github-actions"], "values": { "dayOfWeek": [1] } },
    "provenance": { "kind": "spec" } },
  { "id": "detect-sunday-seven-is-vixie-only", "input": "0 9 * * 7",
    "expectSummary": { "dialect": "vixie", "values": { "dayOfWeek": [0] } },
    "provenance": { "kind": "derived", "source": "corpus/DERIVATION.md K2, G1" } },
  { "id": "detect-single-value-step-excludes-vixie", "input": "20/15 * * * *",
    "expectSummary": { "dialect": "kubernetes", "candidates": ["kubernetes", "github-actions"], "values": { "minute": [20, 35, 50] } },
    "provenance": { "kind": "derived", "source": "corpus/DERIVATION.md H7, K4, G2" } },
  { "id": "detect-crontab-line-is-vixie-only", "input": "0 2 * * * /usr/bin/backup",
    "expectSummary": { "dialect": "vixie" },
    "provenance": { "kind": "spec" } }
]
