[
  { "id": "aws-wrapped-last-friday-whole-schedule", "input": "cron(15 10 ? * 6L 2030)",
    "expect": {
      "dialect": "aws", "source": "cron(15 10 ? * 6L 2030)", "timezone": "UTC",
      "fields": [
        { "name": "minute", "raw": "15", "span": [5, 7], "terms": [{ "raw": "15", "span": [5, 7], "kind": "range", "from": 15, "to": 15, "step": 1 }], "values": [15], "star": false },
        { "name": "hour", "raw": "10", "span": [8, 10], "terms": [{ "raw": "10", "span": [8, 10], "kind": "range", "from": 10, "to": 10, "step": 1 }], "values": [10], "star": false },
        { "name": "dayOfMonth", "raw": "?", "span": [11, 12], "terms": [{ "raw": "?", "span": [11, 12], "kind": "unspecified" }], "values": [], "star": false },
        { "name": "month", "raw": "*", "span": [13, 14], "terms": [{ "raw": "*", "span": [13, 14], "kind": "any", "step": 1 }], "values": [1,2,3,4,5,6,7,8,9,10,11,12], "star": true },
        { "name": "dayOfWeek", "raw": "6L", "span": [15, 17], "terms": [{ "raw": "6L", "span": [15, 17], "kind": "lastDow", "dow": 5 }], "values": [], "star": false },
        { "name": "year", "raw": "2030", "span": [18, 22], "terms": [{ "raw": "2030", "span": [18, 22], "kind": "range", "from": 2030, "to": 2030, "step": 1 }], "values": [2030], "star": false }
      ]
    },
    "provenance": { "kind": "spec", "source": "corpus/DERIVATION.md A4, A6" } },
  { "id": "aws-bare-fields-parse-too", "input": "15 10 ? * 6L 2030", "options": { "dialect": "aws" },
    "expectSummary": { "dialect": "aws", "values": { "minute": [15], "hour": [10], "year": [2030] } },
    "provenance": { "kind": "spec", "source": "corpus/DERIVATION.md A1" } },
  { "id": "aws-hour-range-wraps-as-documented", "input": "cron(0/30 20-2 ? * MON-FRI 2030)",
    "expectSummary": { "dialect": "aws", "values": { "minute": [0, 30], "hour": [0, 1, 2, 20, 21, 22, 23], "dayOfWeek": [1, 2, 3, 4, 5] } },
    "provenance": { "kind": "spec", "source": "corpus/DERIVATION.md A8" } },
  { "id": "aws-sunday-is-one-and-seven-is-saturday", "input": "cron(0 12 ? * 1,7 2030)",
    "expectSummary": { "dialect": "aws", "values": { "dayOfWeek": [0, 6] } },
    "provenance": { "kind": "spec", "source": "corpus/DERIVATION.md A2, A4" } },
  { "id": "aws-zero-is-not-a-day-of-week", "input": "cron(0 12 ? * 0 2030)",
    "expectError": { "code": "out-of-range", "span": [14, 15] },
    "provenance": { "kind": "assumed", "source": "corpus/DERIVATION.md A2" } },
  { "id": "aws-star-slash-step-is-allowed", "input": "cron(*/15 * * * ? 2030)",
    "expectSummary": { "dialect": "aws", "values": { "minute": [0, 15, 30, 45] } },
    "provenance": { "kind": "assumed", "source": "corpus/DERIVATION.md A5" } },
  { "id": "aws-undocumented-quartz-tokens-are-unsupported", "input": "cron(0 12 LW * ? 2030)",
    "expectSummary": { "dialect": "aws", "unsupported": ["dayOfMonth"] },
    "provenance": { "kind": "spec", "source": "corpus/DERIVATION.md A4" } },
  { "id": "aws-year-is-required", "input": "cron(0 12 * * ?)",
    "expectError": { "code": "field-count", "span": [5, 15] },
    "provenance": { "kind": "spec", "source": "corpus/DERIVATION.md A1" } },
  { "id": "aws-year-above-2199", "input": "cron(0 12 * * ? 2200)",
    "expectError": { "code": "out-of-range", "span": [16, 20] },
    "provenance": { "kind": "spec", "source": "corpus/DERIVATION.md A1" } },
  { "id": "aws-unclosed-wrapper", "input": "cron(0 12 * * ? *",
    "expectError": { "code": "bad-wrapper", "span": [0, 17] },
    "provenance": { "kind": "spec", "source": "corpus/DERIVATION.md A6" } },
  { "id": "aws-empty-wrapper", "input": "cron()",
    "expectError": { "code": "field-count", "span": [0, 6] },
    "provenance": { "kind": "spec", "source": "corpus/DERIVATION.md A6" } },
  { "id": "detect-question-mark-position-separates-quartz-from-aws", "input": "0 12 * * ? *",
    "expectSummary": { "dialect": "aws" },
    "provenance": { "kind": "spec", "source": "corpus/DERIVATION.md A3" } },
  { "id": "detect-six-stars-fit-quartz-and-aws", "input": "* * * * * *",
    "expectSummary": { "dialect": "quartz", "candidates": ["quartz", "aws"] },
    "provenance": { "kind": "spec" } }
]
